Latitude,Longitude,Jeosit Adı,Kategori / Grup,Öneren(ler),Açıklama
36.15744754546334,33.33350131393674,Gilindire Mağarası,VIII,Lütfi Nazik,"Kuvaterner deniz düzeyi değişimi etkilerinin görüldüğü bir bölgede ve Kambriyen yaşlı kireçtaşları içinde gelişen, tek mağara olan Gilindire, hapsedilmiş yüksek sıcaklık ve nem ile tatlı ve tuzlu su karışımına sahiptir. Bu nem ve sıcaklık ile deniz ve tatlı su karışımı son derece ilginç ve karakteristik damlataşlar oluşturmuştur. Mağarada mevcut nem-sıcaklık ve göl suyunun fiziko-kimyasal dengesinin küçük bir değişiminde damlataşların gelişimlerinin durmasına ve tahrip olmalarına neden olacaktır."
40.91850916410107,30.59206524341057,Söğütlü Mağarası,VIII,Lütfi Nazik,"Arkasında genişliği 2- 6, derinliği 0.5 – 3 metreler arasında değişen göller oluşan damlataş havuzları; Söğütlü Mağarası’nın en karakteristik ve ilginç şekilleridir. Mağaradaki yeraltı deresinin ağır,fakat devamlı akışına bağlı olarak gelişen bu şekillere,bölgede, hiçbir mağarada rastlanmamıştır. Yeraltı deresinin akışı, debisi ve beslenme alanında meydana gelecek küçük bir değişiklik, damlataş havuzlarının gelişimlerinin durmasına neden olacaktır."
40.34098749057068,41.8647397147644,Kırmızı Mutluluk Vadisi,VIII,Fuat Şaroğlu,"Kırmızı renkli Pliyosen yaşlı kumtaşı-çakıltaşları, tipik karasal fasiyesler, Peribacalarına benzer oluşumlar ve kanyon tipi vadi oluşumu mevcuttur. Renk ve oluşumlarıyla çok güzel bir görünüme sahiptir. Vadide akustik ses özelliği vardır. Ender rastlanan bir görünümdür."
38.53920917821346,42.25992326589153,Nemrut Kervanı / Nemrut Develeri,VIII,Ahmet Türkecan,"Nemrut güneyinde Şıhmiran Köyü ile Tatvan arasında laharik tüfler görülmektedir. Vadi içini dolduran bir lahar akıntısının erozyon sonucu aşınmasından arda kalan tepecikler dizisi. Sayısı kırk kadar olup, bir dizi şeklinde olduklarından bir deve kervanı şeklinde görülmekte ve halk tarafından Nemrutun develeri olarak isimlendirilmektedirler."
40.47228412326604,39.38462443612352,Antik maden ocakları,XII,Faruk Çalapkulu,Sn maden yatağı Romalalılar zamanında para basılmış-Arkeometalurji-o günkü işletmelerle ilgili galeriler var
39.44176281430012,44.23706246244953,Nuh’un Gemisi – Telçeker Heyelanı,VIII,Ahmet Türkecan,"Nuh’un Gemisi olarak tanımlanan şekil gemi biçimli bir heyelan olup, İran transit karayoluna 3,5 km dir. 1950 lerden bu yana gemiye benzetilen yapı karmaşık türden bir heyelan yapısı olarak tanımlanmaktadır (Güner, 1986)."
40.99085288513251,40.38731695952399,Pileki taşı,XII,Faruk Çalapkulu,"Kretase yaşlı volkano-sedimanter kayaların içine özgün nitelikli seviyelerde çıkarılan bloklar, oyularak gömme ekmeklerin pişirilmesinde kullanılıyor. Tarihsel BİR GEÇMİŞİ ULŞUNMAKTADIR."
40.51877266079649,33.42174981414743,Çankırı – Eldivan – Şabanözü-,XII,"Gerçek Saraç, Levent Karadenizli","Akyürek ve diğ. (1979, 1980, 1981) tarafından “Eldivan Ofiyolit Kompleksi” olarak tanımlanan birim dunit-harzburjit, peridotit, piroksenit, gabro-diyabaz, spilit, radyolarit, kireçtaşı, volkanitler ve bunlarla ilgili yastık lav ve serpantinitlerden oluşmaktadır. Hsü (1968) yayımıyla tüm dünyaya „Melanj“ tanımını tanıtan bölgedir."
39.75554341124445,27.5909218187627,Balya İlk termik santral 1900de Fransızlar kurmuş,XIII,"Faruk Çalapkulu, Hülya İnaner","İlk termik santral, Fransızlar kurmuş. Gönen’e doğru dik kömür damarları var. 4500 kalori ısı değeri olan kömürler."
